{
  "$schema": "https://json-schema.org/draft/2020-12/schema",
  "$id": "https://github.com/zach/automap/schemas/recipe.schema.json",
  "title": "Recipe",
  "description": "What Automap provides for one binding, pairing or library. map/recipes/<kind>/<subject>.json",
  "type": "object",
  "additionalProperties": false,
  "required": [
    "kind",
    "subject",
    "applies_to",
    "reference_glue",
    "probes",
    "adaptation_notes"
  ],
  "properties": {
    "kind": {
      "enum": [
        "binding",
        "pairing",
        "library"
      ]
    },
    "subject": {
      "type": "object",
      "additionalProperties": false,
      "properties": {
        "library": {
          "type": "string",
          "pattern": "^[a-z0-9][a-z0-9-]*$"
        },
        "contract": {
          "enum": [
            "allocation",
            "jobs",
            "math-types",
            "handles",
            "lifecycle",
            "diagnostics",
            "serialization",
            "build-flags",
            "platform",
            "determinism",
            "assets"
          ]
        },
        "contract_version": {
          "type": "string",
          "pattern": "^\\d+\\.\\d+\\.\\d+$"
        },
        "libraries": {
          "type": "array",
          "minItems": 2,
          "maxItems": 2,
          "items": {
            "type": "string",
            "pattern": "^[a-z0-9][a-z0-9-]*$"
          }
        }
      }
    },
    "applies_to": {
      "type": "object",
      "description": "Library versions and variants this recipe was verified for, keyed by library id.",
      "additionalProperties": {
        "type": "object",
        "additionalProperties": false,
        "required": [
          "versions",
          "variants"
        ],
        "properties": {
          "versions": {
            "type": "array",
            "minItems": 1,
            "items": {
              "type": "string"
            }
          },
          "variants": {
            "type": "array",
            "minItems": 1,
            "items": {
              "type": "string",
              "pattern": "^[a-z0-9][a-z0-9-]*$"
            }
          }
        }
      }
    },
    "reference_glue": {
      "type": "array",
      "items": {
        "type": "object",
        "additionalProperties": false,
        "required": [
          "path",
          "role"
        ],
        "properties": {
          "path": {
            "type": "string"
          },
          "role": {
            "enum": [
              "glue",
              "build-fragment",
              "setup-glue",
              "probe"
            ]
          }
        }
      }
    },
    "entry_points": {
      "type": "array",
      "items": {
        "type": "object",
        "additionalProperties": false,
        "required": [
          "phase",
          "when",
          "call"
        ],
        "properties": {
          "phase": {
            "enum": [
              "memory",
              "diagnostics",
              "platform",
              "jobs",
              "systems",
              "game"
            ]
          },
          "when": {
            "enum": [
              "init",
              "shutdown"
            ]
          },
          "call": {
            "type": "string",
            "pattern": "^[A-Za-z_][A-Za-z0-9_]*$",
            "description": "A function in the recipe's glue taking the context; init calls return whether they succeeded (ADR-0080)."
          },
          "after": {
            "type": "array",
            "items": {
              "type": "string"
            },
            "description": "Steps that must have run before this entry point, within its phase; the startup runs the entry points performing them first."
          },
          "provides": {
            "type": "array",
            "description": "Context fields this entry point sets.",
            "items": {
              "type": "object",
              "additionalProperties": false,
              "required": [
                "name",
                "type"
              ],
              "properties": {
                "name": {
                  "type": "string",
                  "pattern": "^[a-z0-9][a-z0-9-]*\\.[a-z0-9_]+$"
                },
                "type": {
                  "type": "string",
                  "description": "The C++ type of the field."
                }
              }
            }
          },
          "reads": {
            "type": "array",
            "description": "Context fields this entry point reads; each must be provided by an entry point that runs earlier.",
            "items": {
              "type": "string",
              "pattern": "^[a-z0-9][a-z0-9-]*\\.[a-z0-9_]+$"
            }
          },
          "steps": {
            "type": "array",
            "items": {
              "type": "string"
            },
            "description": "The lifecycle steps this entry point performs and records, in order. Another entry point's `after` names these steps; the startup orders entry points within a phase by them."
          }
        }
      }
    },
    "rules": {
      "type": "array",
      "description": "Pairing recipes only: the pairing's own rules.",
      "items": {
        "$ref": "contract.schema.json#/$defs/rule"
      }
    },
    "ordering": {
      "type": "array",
      "description": "Pairing recipes only: cross-library ordering constraints. The 'before' step must run before the 'after' step; steps are '<owner>:<name>', where the owner is a library id or this pairing's id.",
      "items": {
        "type": "object",
        "additionalProperties": false,
        "required": [
          "before",
          "after",
          "when"
        ],
        "properties": {
          "before": {
            "type": "string"
          },
          "after": {
            "type": "string"
          },
          "when": {
            "enum": [
              "init",
              "shutdown"
            ]
          }
        }
      }
    },
    "probes": {
      "type": "array",
      "items": {
        "type": "object",
        "additionalProperties": false,
        "required": [
          "rule",
          "check",
          "seeded_violation"
        ],
        "properties": {
          "rule": {
            "type": "string"
          },
          "check": {
            "type": "string",
            "description": "The glue function or procedure that performs the check."
          },
          "seeded_violation": {
            "type": "object",
            "additionalProperties": false,
            "required": [
              "description",
              "patch"
            ],
            "properties": {
              "description": {
                "type": "string",
                "description": "The known mistake, in words."
              },
              "patch": {
                "type": "string",
                "pattern": "\\.(patch|json-patch)$",
                "description": "A unified diff (.patch) against reference glue, a build fragment, setup glue or a shared interface, or an RFC 6902 JSON Patch (.json-patch) against the manifest; paths are relative to the recipe's or contract version's directory. Never against a file the CLI generates."
              }
            }
          }
        }
      }
    },
    "not_applicable": {
      "type": "array",
      "items": {
        "type": "object",
        "additionalProperties": false,
        "required": [
          "rule",
          "reason"
        ],
        "properties": {
          "rule": {
            "type": "string"
          },
          "reason": {
            "type": "string"
          }
        }
      }
    },
    "adaptation_notes": {
      "type": "array",
      "items": {
        "type": "string"
      }
    }
  },
  "allOf": [
    {
      "if": {
        "properties": {
          "kind": {
            "const": "binding"
          }
        }
      },
      "then": {
        "properties": {
          "subject": {
            "required": [
              "library",
              "contract",
              "contract_version"
            ]
          }
        }
      }
    },
    {
      "if": {
        "properties": {
          "kind": {
            "const": "pairing"
          }
        }
      },
      "then": {
        "properties": {
          "subject": {
            "required": [
              "libraries"
            ]
          }
        },
        "required": [
          "rules"
        ]
      }
    },
    {
      "if": {
        "properties": {
          "kind": {
            "const": "library"
          }
        }
      },
      "then": {
        "properties": {
          "subject": {
            "required": [
              "library"
            ]
          }
        }
      }
    }
  ]
}
