{
  "kind": "binding",
  "subject": {
    "library": "stb-image",
    "contract": "assets",
    "contract_version": "1.0.0"
  },
  "applies_to": {
    "stb-image": {
      "versions": [
        "2026-08-02"
      ],
      "variants": [
        "default"
      ]
    }
  },
  "reference_glue": [
    {
      "path": "stb-image--assets/stb_image_assets.h",
      "role": "glue"
    },
    {
      "path": "stb-image--assets/stb_image_assets.cpp",
      "role": "glue"
    },
    {
      "path": "stb-image--assets/stb_image_assets_probe.cpp",
      "role": "probe"
    }
  ],
  "probes": [
    {
      "rule": "assets.reads-through-interface",
      "check": "am_probe_stb_image_assets(): decoding a sample PNG file reads it once, through the assets interface.",
      "seeded_violation": {
        "description": "Decode the file with stbi_load, which opens it with the C runtime.",
        "patch": "stb-image--assets/seeded/assets.reads-through-interface.patch"
      }
    },
    {
      "rule": "assets.output-identical",
      "check": "am_probe_stb_image_assets(): decoding the sample twice gives the same size and pixels.",
      "seeded_violation": {
        "description": "Stamp a decode counter into the first pixel, to tell decodes apart while debugging.",
        "patch": "stb-image--assets/seeded/assets.output-identical.patch"
      }
    }
  ],
  "adaptation_notes": [
    "am_stb_image_load() reads the file through the assets interface and decodes it with stbi_load_from_memory; it takes and returns what stbi_load does.",
    "stbi_set_flip_vertically_on_load and the requested channel count change the output: a cooker records them with what it writes."
  ]
}
